{
  "submissionId": "7e2f843e-d639-40b3-8611-8015f3a18958",
  "prosecutionCaseSubject": {
    "urn": "caseURN",
    "prosecutingAuthority": "The OU Code of the prosecuting authority"
  },
  "defendantOffencesSubjects": [
    {
      "defendant": {
        "prosecutorDefendantId": "defendant Id"
      },
      "offences": [
        {
          "cjsOffenceCode": "offenceCode",
          "offenceDate" : "2021-09-27",
          "offenceWording": "offenceWording"
        }
      ]
    }
  ],
  "evidencePrePTPH": "evidencePrePTPH text"
}